{
  "deviceId": "6f1c8d2e-4a3b-4c5d-9e6f-7a8b9c0d1e2f",
  "hour": 1792659600,
  "agent": "claude-code",
  "model": "claude-opus-5-5",
  "inputTokens": 80100000,
  "cacheReadTokens": 76000000,
  "cacheWriteTokens": 2400000,
  "outputTokens": 11345,
  "reasoningTokens": 8120,
  "requests": 2210,
  "sessionsStarted": 41,
  "costUsd": 312.4,
  "unpricedRequests": 0
}
